{
  "schema": "gtcx://ecosystem-os/kaleidoscope-ai/phase-3-resources/v1",
  "generatedAt": "2026-06-29T05:15:17.617Z",
  "date": "2026-06-29",
  "repo": "ecosystem-os",
  "phase": "phase-3-internal-product-resources",
  "ok": true,
  "summary": {
    "resourceCount": 9,
    "resources": [
      "fleet",
      "graph",
      "query",
      "decision-room",
      "signal",
      "actions",
      "partner-room",
      "release",
      "phase-2"
    ],
    "passedResourceChecks": 9,
    "failedResourceChecks": 0,
    "failedResources": [],
    "readOnlyResources": 7,
    "draftResources": 2,
    "externalUse": "blocked_until_explicit_approval"
  },
  "validation": [
    {
      "resource": "fleet",
      "ok": true,
      "issues": []
    },
    {
      "resource": "graph",
      "ok": true,
      "issues": []
    },
    {
      "resource": "query",
      "ok": true,
      "issues": []
    },
    {
      "resource": "decision-room",
      "ok": true,
      "issues": []
    },
    {
      "resource": "signal",
      "ok": true,
      "issues": []
    },
    {
      "resource": "actions",
      "ok": true,
      "issues": []
    },
    {
      "resource": "partner-room",
      "ok": true,
      "issues": []
    },
    {
      "resource": "release",
      "ok": true,
      "issues": []
    },
    {
      "resource": "phase-2",
      "ok": true,
      "issues": []
    }
  ],
  "responses": [
    {
      "schema": "gtcx://ecosystem-os/kaleidoscope-ai/product-surface-api/v1",
      "resource": "fleet",
      "generatedAt": "2026-06-29T05:15:17.617Z",
      "mode": "read",
      "decision": "fleet-ready-read-only",
      "confidence": 0.95,
      "freshness": {
        "status": "fresh",
        "sourceDates": [
          {
            "path": "audit/evidence/kaleidoscope-observatory-latest.json",
            "sourceDate": "2026-06-29T01:31:17.444Z"
          },
          {
            "path": "audit/evidence/kaleidoscope-graph-rag-mcp-latest.json",
            "sourceDate": "2026-06-29T01:31:17.225Z"
          },
          {
            "path": "audit/evidence/signal-fleet-latest.json",
            "sourceDate": "2026-06-29T01:31:17.370Z"
          }
        ]
      },
      "citations": [
        {
          "path": "audit/evidence/kaleidoscope-observatory-latest.json",
          "reason": "fleet readiness, blockers, freshness, commercial evidence, and aliases",
          "sourceDate": "2026-06-29T01:31:17.444Z"
        },
        {
          "path": "audit/evidence/kaleidoscope-graph-rag-mcp-latest.json",
          "reason": "graph/RAG/MCP/eval readiness by repo",
          "sourceDate": "2026-06-29T01:31:17.225Z"
        },
        {
          "path": "audit/evidence/signal-fleet-latest.json",
          "reason": "SIGNAL and MPR relation maturity by repo",
          "sourceDate": "2026-06-29T01:31:17.370Z"
        }
      ],
      "assumptions": [],
      "unsupportedClaims": [],
      "approval": {
        "status": "not_required",
        "boundary": "read",
        "reason": "Read-only resource. No repo write, ticket creation, deployment, publication, partner contact, or external sharing is authorized.",
        "approvalRecord": null
      },
      "nextActions": [],
      "witnesses": [
        "audit/evidence/kaleidoscope-observatory-latest.json",
        "audit/evidence/kaleidoscope-graph-rag-mcp-latest.json",
        "audit/evidence/signal-fleet-latest.json"
      ],
      "payload": {
        "route": "/kaleidoscope/fleet",
        "summary": {
          "repoCount": 20,
          "readyRepos": 20,
          "blockerCount": 0,
          "aliasWarningCount": 0,
          "freshEvidenceRepos": 20,
          "movementAvailable": true,
          "commercialEvidenceCompleteRepos": 20,
          "commercialEvidencePartialRepos": 0,
          "commercialEvidenceGapRepos": 0
        },
        "repoCount": 20,
        "readinessCounts": {
          "ready": 20
        },
        "commercialEvidenceCounts": {
          "complete": 20
        },
        "repos": [
          {
            "repo": "baseline-os",
            "tier": 0,
            "role": "RAG/MCP hub and validator owner",
            "readiness": {
              "maturity": "ready",
              "score100": 100,
              "targetStatus": "restore"
            },
            "blockers": {
              "count": 0,
              "items": []
            },
            "signal": {
              "level": "L1",
              "score100": 25,
              "bottlenecks": [
                "systemsArchitecture limits SIGNAL-P to L1",
                "systemsArchitecture limits SIGNAL-E to L2",
                "Define product-intelligence surface or mark repo as infrastructure-only.",
                "No production user-facing AI trace, eval, or feedback loop is published yet.",
                "Connect product-intelligence findings to roadmap, QA, and release evidence.",
                "Publish hallucination, approval, and user-impact safeguards for AI product outputs."
              ]
            },
            "mpr": {
              "composite100": 100,
              "source": "baseline-os/audit/evidence/mpr-repo-latest.json",
              "evaluatedAt": "2026-06-27T14:38:25.546Z"
            },
            "evidenceFreshness": {
              "fresh": true,
              "oldestSourceDate": "2026-06-28T16:54:47.591Z",
              "newestSourceDate": "2026-06-28T16:55:46.741Z",
              "newestAgeDays": 0,
              "evidenceCount": 4
            },
            "commercialEvidence": {
              "evidencedCategories": 5,
              "categoryCount": 5,
              "complete": true
            }
          },
          {
            "repo": "bridge-os",
            "tier": 0,
            "role": "MCP/action orchestration and fleet coordination",
            "readiness": {
              "maturity": "ready",
              "score100": 100,
              "targetStatus": "restore"
            },
            "blockers": {
              "count": 0,
              "items": []
            },
            "signal": {
              "level": "L1",
              "score100": 25,
              "bottlenecks": [
                "systemsArchitecture limits SIGNAL-P to L1",
                "process limits SIGNAL-E to L1",
                "Define product-intelligence surface or mark repo as infrastructure-only.",
                "No production user-facing AI trace, eval, or feedback loop is published yet.",
                "Connect product-intelligence findings to roadmap, QA, and release evidence.",
                "Publish hallucination, approval, and user-impact safeguards for AI product outputs."
              ]
            },
            "mpr": {
              "composite100": null,
              "source": "missing",
              "evaluatedAt": null
            },
            "evidenceFreshness": {
              "fresh": true,
              "oldestSourceDate": "2026-06-28T11:22:11.500Z",
              "newestSourceDate": "2026-06-28T17:07:10.396Z",
              "newestAgeDays": 0,
              "evidenceCount": 4
            },
            "commercialEvidence": {
              "evidencedCategories": 5,
              "categoryCount": 5,
              "complete": true
            }
          },
          {
            "repo": "ecosystem-os",
            "tier": 0,
            "role": "Ecosystem graph and Kaleidoscope home",
            "readiness": {
              "maturity": "ready",
              "score100": 100,
              "targetStatus": "strengthen"
            },
            "blockers": {
              "count": 0,
              "items": []
            },
            "signal": {
              "level": "L2",
              "score100": 45,
              "bottlenecks": [
                "systemsArchitecture limits SIGNAL-P to L2",
                "systemsArchitecture limits SIGNAL-E to L2",
                "No production user-facing AI trace, eval, or feedback loop is published yet.",
                "Connect product-intelligence findings to roadmap, QA, and release evidence.",
                "Publish hallucination, approval, and user-impact safeguards for AI product outputs.",
                "Publish product-feedback, trace, and answer-quality metrics."
              ]
            },
            "mpr": {
              "composite100": 59,
              "source": "ecosystem-os/audit/evidence/mpr-repo-latest.json",
              "evaluatedAt": "2026-06-28T11:14:29.380Z"
            },
            "evidenceFreshness": {
              "fresh": true,
              "oldestSourceDate": "2026-06-29T01:31:17.188Z",
              "newestSourceDate": "2026-06-29T01:31:17.189Z",
              "newestAgeDays": 0,
              "evidenceCount": 4
            },
            "commercialEvidence": {
              "evidencedCategories": 5,
              "categoryCount": 5,
              "complete": true
            }
          },
          {
            "repo": "compliance-os",
            "tier": 1,
            "role": "Compliance operating layer",
            "readiness": {
              "maturity": "ready",
              "score100": 100,
              "targetStatus": "restore"
            },
            "blockers": {
              "count": 0,
              "items": []
            },
            "signal": {
              "level": "L2",
              "score100": 45,
              "bottlenecks": [
                "systemsArchitecture limits SIGNAL-P to L2",
                "systemsArchitecture limits SIGNAL-E to L2",
                "No production user-facing AI trace, eval, or feedback loop is published yet.",
                "Connect product-intelligence findings to roadmap, QA, and release evidence.",
                "Publish hallucination, approval, and user-impact safeguards for AI product outputs.",
                "Publish product-feedback, trace, and answer-quality metrics."
              ]
            },
            "mpr": {